Producto,Precio,Precio_Unidad,Peso,Categoria,Marca,Fecha,Precio_Promocion,Link,link
Pastas DORIA fideos clásicos (500 gr),$ 4.190,Gr a $ 8,500 gr,Pastas,DORIA,2025-01-14,,,
Pasta LA MUNECA corta tornillos (500 gr),$ 4.200,Gr a $ 8,500 gr,Pasta,LA MUNECA,2025-01-14,,,
Cereal CHOCAPIC sabor chocolate bolsa (380 gr),$ 16.400,Gr a $ 43,380 gr,Cereal,CHOCAPIC,2025-01-14,,,
Arroz ROA (5000 gr),$ 21.590,Gr a $ 4,5000 gr,Arroz,ROA,2025-01-14,,,
Harina FRESCAMPO de trigo (500 gr),$ 1.740,Gr a $ 3,500 gr,Harina,FRESCAMPO,2025-01-14,,,
Chocolate De Mesa CORONA Instantáneo (200 gr),$ 9.270,Gr a $ 46,200 gr,Chocolate,CORONA,2025-01-14,,,
Mayonesa FRUCO Receta Artesanal (250 gr),$ 10.500,Gr a $ 42,250 gr,Mayonesa,FRUCO,2025-01-14,,,
Atun ISABEL (104 gr),$ 9.040,Gr a $ 86,104 gr,Atun,ISABEL,2025-01-14,,,
Caldo con costilla MAGGI Desmenuzado paga 10 lleva 12 (90 gr),$ 5.050,Gr a $ 56,90 gr,Caldo,MAGGI,2025-01-14,,,
Cocoa CORONA Baja en grasa (230 gr),$ 16.550,Gr a $ 71,230 gr,Cocoa,CORONA,2025-01-14,,,
Anchetas en Caja,$ 39.950,Und a $ 39.950,,Anchetas,,2025-01-14,,,
Azúcar EXITO MARCA PROPIA blanca (500 gr),$ 2.590,Gr a $ 5,500 gr,Azúcar,EXITO MARCA PROPIA,2025-01-14,,,
Bebida achocolatada CHOCOLISTO En polvo (200 gr),$ 8.500,Gr a $ 42,200 gr,Bebida,CHOCOLISTO,2025-01-14,,,
Panela Fraccionada FONCE 900 gr,$ 11.850,Gr a $ 13,,Panela,FONCE,2025-01-14,,,
Atún VAN CAMPS En agua natural (104 gr),$ 8.580,Gr a $ 82,104 gr,Atún,VAN CAMPS,2025-01-14,,,
Mermelada SAN JORGE De frutos rojos (200 gr),$ 5.130,Gr a $ 25,200 gr,Mermelada,SAN JORGE,2025-01-14,,,
Caldo de gallina DONA GALLINA desmenuzado x12und (81 gr),$ 4.560,Gr a $ 56,81 gr,Caldo,DONA GALLINA,2025-01-14,,,
Granola EXITO MARCA PROPIA sabor a vainilla (500 gr),$ 7.110,Gr a $ 14,500 gr,Granola,EXITO MARCA PROPIA,2025-01-14,,,
Pasta LA MUNECA corta letras (250 gr),$ 2.160,Gr a $ 8,250 gr,Pasta,LA MUNECA,2025-01-14,,,
Crema de maní TAEQ 100% natural (300 gr),$ 10.450,Gr a $ 34,300 gr,Crema,TAEQ,2025-01-14,,,
Macarrón DORIA Con Salsa De Queso (210 gr),$ 4.570,Gr a $ 21,210 gr,Macarrón,DORIA,2025-01-14,,,
Color EL REY (90 gr),$ 3.100,Gr a $ 34,90 gr,Color,EL REY,2025-01-14,,,
Azúcar EXITO MARCA PROPIA morena (2500 gr),$ 12.240,Gr a $ 4,2500 gr,Azúcar,EXITO MARCA PROPIA,2025-01-14,,,
Sal REFISAL baja en sodio con potasio (400 gr),$ 5.070,Gr a $ 12,400 gr,Sal,REFISAL,2025-01-14,,,
Aceite PREMIER girasol (2700 ml),$ 39.225,Ml a $ 14,2700 ml,Aceite,PREMIER,2025-01-14,,,
GARBANZO DIANA (500 gr),$ 6.290,Gr a $ 12,500 gr,GARBANZO,GARBANZO DIANA,2025-01-14,,,
Bebida En Polvo CLIGHT Sin Calorías Sabor Mandarina (14 gr),$ 2.720,Gr a $ 194,14 gr,Bebida,CLIGHT,2025-01-14,,,
"Mezcla HAZ DE OROS pancakes, crepes o waffles (600 gr)",$ 12.650,Gr a $ 21,600 gr,Mezcla,HAZ DE OROS,2025-01-14,,,
Ancheta Tentación,$ 47.900,Und a $ 47.900,,Ancheta,,2025-01-14,,,
LENTEJA DIANA (1 gr),$ 9.580,Gr a $ 9.580,1 gr,LENTEJA,LENTEJA DIANA,2025-01-14,,,
Crema no láctea INSTACREM original (430 gr),$ 18.250,Gr a $ 42,430 gr,Crema,INSTACREM,2025-01-14,,,
Salsa BBQ BARY Doypack (400 gr),$ 10.100,Gr a $ 25,400 gr,Salsa,BBQ BARY,2025-01-14,,,
Aromatica Cidron FRESCAMPO 15 gr,$ 2.190,Gr a $ 146,,Aromatica,FRESCAMPO,2025-01-14,,,
Vinagre TAEQ sidra de manzana orgánico (500 ml),$ 12.450,Ml a $ 24,500 ml,Vinagre,TAEQ,2025-01-14,,,
Pasta CONZAZONI corta fusilli (500 gr),$ 8.990,Gr a $ 17,500 gr,Pasta,CONZAZONI,2025-01-14,,,
Bebida en polvo NESQUIK sabor a chocolate doypack (400 gr),$ 14.450,Gr a $ 36,400 gr,Bebida,NESQUIK,2025-01-14,,,
Frijol FRESCAMPO granos seleccionados (1000 gr),$ 9.970,Gr a $ 9,1000 gr,Frijol,FRESCAMPO,2025-01-14,,,
Canela EL REY (20 gr),$ 5.270,Gr a $ 263,20 gr,Canela,EL REY,2025-01-14,,,
Gelatina Sin Azúcar Sabor Limón TAEQ 11 gr,$ 1.680,Gr a $ 152,,Gelatina,TAEQ,2025-01-14,,,
Quinua DORIA en grano (300 gr),$ 8.810,Gr a $ 29,300 gr,Quinua,DORIA,2025-01-14,,,
Harina PAN (500 gr),$ 2.700,Gr a $ 5,500 gr,Harina,PAN,2025-01-14,,,
Arroz DIANA (500 gr),$ 3.890,Gr a $ 7,500 gr,Arroz,DIANA,2025-01-14,,,
Cereal FROOT LOOPS Froot Loops Frutal (450 gr),$ 30.450,Gr a $ 67,450 gr,Cereal,FROOT LOOPS,2025-01-14,,,
Tortillas BIMBO Integrales Tamaño M x8und (250 gr),$ 9.520,Gr a $ 38,250 gr,Tortillas,BIMBO M,2025-01-14,,,
Sal REFISAL marina (800 gr),$ 4.770,Gr a $ 5,800 gr,Sal,REFISAL,2025-01-14,,,
Arroz FEDERAL Premium extra gourmet (2500 gr),$ 26.450,Gr a $ 10,2500 gr,Arroz,FEDERAL,2025-01-14,,,
"Arvejas con zanahoria ZENU lata, sin conservantes (190 gr)",$ 5.010,Gr a $ 26,190 gr,Arvejas,ZENU,2025-01-14,,,
Galletas TOSH Tipo sandwich cremadas surtidas (294.4 gr),$ 18.700,Gr a $ 63,294.4 gr,Galletas,TOSH,2025-01-14,,,
Salsa LA CONSTANCIA BBQ (400 gr),$ 11.350,Gr a $ 28,400 gr,Salsa,LA CONSTANCIA BBQ,2025-01-14,,,
Café Descafeinado NESCAFE DECAF instantáneo (100 gr),$ 15.600,Gr a $ 156,100 gr,Café,NESCAFE DECAF,2025-01-14,,,
Galletas RITZ Rellenas de Crema Sabor Queso x6paq (180 gr),$ 10.600,Gr a $ 58,180 gr,Galletas,RITZ,2025-01-14,,,
Aceite EXITO MARCA PROPIA de girasol (750 ml),$ 7.590,Ml a $ 10,750 ml,Aceite,EXITO MARCA PROPIA,2025-01-14,,,
Harina de trigo HAZ DE OROS tradicional (2500 gr),$ 11.400,Gr a $ 4,2500 gr,Harina,HAZ DE OROS,2025-01-14,,,
Tortillas BIMBO Fajitas tamaño L x10und (425 gr),$ 11.800,Gr a $ 27,425 gr,Tortillas,BIMBO L,2025-01-14,,,
Mezcla Maiz Dulce PAN Harina de Maiz Dulce (850 gr),$ 9.500,Gr a $ 11,850 gr,Mezcla,PAN,2025-01-14,,,
Atún VAN CAMPS En aceite de oliva (104 gr),$ 10.300,Gr a $ 99,104 gr,Atún,VAN CAMPS,2025-01-14,,,
Panela Pastilla EKONO 950 gr,$ 5.900,Gr a $ 6,,Panela,EKONO,2025-01-14,,,
Té en polvo SUNTEA sabor a limón mandarino (12 gr),$ 1.510,Gr a $ 125,12 gr,Té,SUNTEA,2025-01-14,,,
Galletas NUCITA Wafer Nucita x8und (160 gr),$ 7.240,Gr a $ 45,160 gr,Galletas,NUCITA,2025-01-14,,,
Café BUENDIA Liofilizado (85 gr),$ 18.250,Gr a $ 214,85 gr,Café,BUENDIA,2025-01-14,,,
Curcuma EL REY Pura (25 gr),$ 2.120,Gr a $ 84,25 gr,Curcuma,EL REY,2025-01-14,,,
Tortillas TIA ROSA De Trigo x12und (300 gr),$ 6.550,Gr a $ 21,300 gr,Tortillas,TIA ROSA,2025-01-14,,,
Bicarbonato MAXSODA (500 gr),$ 3.620,Gr a $ 7,500 gr,Bicarbonato,MAXSODA,2025-01-14,,,
Brevas FRESCAMPO en almíbar (320 gr),$ 9.980,Gr a $ 31,320 gr,Brevas,FRESCAMPO,2025-01-14,,,
Café JUAN VALDEZ Liofilizado vanicanela (95 gr),$ 26.600,Gr a $ 280,95 gr,Café,JUAN VALDEZ,2025-01-14,,,
Atún EXITO MARCA PROPIA lomitos en aceite x3und (331.5 gr),$ 16.170,Gr a $ 48,331.5 gr,Atún,EXITO MARCA PROPIA,2025-01-14,,,
Azúcar Orgánica MANUELITA (800 gr),$ 5.760,Gr a $ 7,800 gr,Azúcar,MANUELITA,2025-01-14,,,
Cereal EKONO aros frutales (230 gr),$ 4.480,Gr a $ 19,230 gr,Cereal,EKONO,2025-01-14,,,
Bebida En Polvo CLIGHT Sin Calorías Sabor A Piña (14 gr),$ 2.720,Gr a $ 194,14 gr,Bebida,CLIGHT A,2025-01-14,,,
Aromatica Toronjil FRESCAMPO 15 gr,$ 2.190,Gr a $ 146,,Aromatica,FRESCAMPO,2025-01-14,,,
Arroz FEDERAL Premium alto rendimiento (2500 gr),$ 18.650,Gr a $ 7,2500 gr,Arroz,FEDERAL,2025-01-14,,,
Aceite PREMIER girasol (500 ml),$ 11.150,Cm3 a $ 22,500 ml,Aceite,PREMIER,2025-01-14,,,
Azucar RIOPAILA (2500 gr),$ 12.750,Gr a $ 5,2500 gr,Azucar,RIOPAILA,2025-01-14,,,
Café EXITO MARCA PROPIA instantáneo granulado (85 gr),$ 8.900,Gr a $ 104,85 gr,Café,EXITO MARCA PROPIA,2025-01-14,,,
Color FRESCAMPO polvo mezcla condimentada (55 gr),$ 1.390,Gr a $ 25,55 gr,Color,FRESCAMPO,2025-01-14,,,
Arroz FLOR HUILA (1000 gr),$ 4.900,Gr a $ 4,1000 gr,Arroz,FLOR HUILA,2025-01-14,,,
AVENA EN HOJUELAS QUAKER 400 gr,$ 5.100,Gr a $ 12,,AVENA,AVENA EN HOJUELAS QUAKER,2025-01-14,,,
Canela FRESCAMPO molida (50 gr),$ 4.420,Gr a $ 88,50 gr,Canela,FRESCAMPO,2025-01-14,,,
Galletas CHOKIS Chispas Chocolate x6und 37gr (222 gr),$ 11.450,Gr a $ 51,222 gr,Galletas,CHOKIS,2025-01-14,,,
"Aromática TOSH Manzanilla, jengibre, limón y miel (22 gr)",$ 8.910,Gr a $ 405,22 gr,Aromática,TOSH,2025-01-14,,,
Bebida En Polvo CLIGHT Sin Calorías Sabor A Naranja (14 gr),$ 2.720,Gr a $ 194,14 gr,Bebida,CLIGHT A,2025-01-14,,,
Harina de trigo HAZ DE OROS con polvo para hornear (500 gr),$ 3.140,Gr a $ 6,500 gr,Harina,HAZ DE OROS,2025-01-14,,,
Galletas SALTINAS 3 TACOS INTEGRAL (324 gr),$ 9.610,Gr a $ 29,324 gr,Galletas,SALTINAS TACOS INTEGRAL,2025-01-14,,,
Champiñones TO EAT MARCA EXCLUSIVA Enteros (114 gr),$ 3.990,Gr a $ 35,114 gr,Champiñones,TO EAT MARCA EXCLUSIVA,2025-01-14,,,
Avena Hojuelas Sin Gluten TONING 1000 gr,$ 17.850,Gr a $ 17,,Avena,TONING,2025-01-14,,,
Caldo de gallina EKONO x8 cubos (138 gr),$ 3.110,Gr a $ 22,138 gr,Caldo,EKONO,2025-01-14,,,
Frijol FRESCAMPO del campo granos seleccionados (500 gr),$ 4.200,Gr a $ 8,500 gr,Frijol,FRESCAMPO,2025-01-14,,,
Café OMA (250 gr),$ 10.850,Gr a $ 43,250 gr,Café,OMA,2025-01-14,,,
Caldo de gallina EKONO x8 cubos (92 gr),$ 2.070,Gr a $ 22,92 gr,Caldo,EKONO,2025-01-14,,,
Galletas FESTIVAL Fresa x 12und (403 gr),$ 11.850,Gr a $ 29,403 gr,Galletas,FESTIVAL,2025-01-14,,,
Vinagre COLMANS blanco especial (500 ml),$ 2.900,Ml a $ 5,500 ml,Vinagre,COLMANS,2025-01-14,,,
Café MATIZ tostión media y molienda gruesa (340 gr),$ 26.400,Gr a $ 77,340 gr,Café,MATIZ,2025-01-14,,,
Tricompleto EL REY (55 gr),$ 1.990,Gr a $ 36,55 gr,Tricompleto,EL REY,2025-01-14,,,
Té HINDU Caja (80 gr),$ 14.450,Gr a $ 180,80 gr,Té,HINDU,2025-01-14,,,
Aceite DIANA (3000 ml),$ 36.050,Cm3 a $ 12,3000 ml,Aceite,DIANA,2025-01-14,,,
Panela Pulverizada DORIGENN 500 gr,$ 8.650,Gr a $ 17,,Panela,DORIGENN,2025-01-14,,,
Vinagre BARY Blanco (1000 gr),$ 7.430,Gr a $ 7,1000 gr,Vinagre,BARY,2025-01-14,,,
Mayonesa BARY Doypack (1000 gr),$ 16.900,Gr a $ 16,1000 gr,Mayonesa,BARY,2025-01-14,,,
Salsa de tomate HEINZ Tomato ketchup squeeze (397 gr),$ 16.950,Gr a $ 42,397 gr,Salsa,HEINZ,2025-01-14,,,
Galletas MILO Anillos relleno crema x12 paquetes (390 gr),$ 13.250,Gr a $ 33,390 gr,Galletas,MILO,2025-01-14,,,
Salsa LA CONSTANCIA Mayonesa (190 gr),$ 5.980,Gr a $ 31,190 gr,Salsa,LA CONSTANCIA,2025-01-14,,,
Chocolate GIRONES Chocolate (500 gr),$ 15.350,Gr a $ 30,500 gr,Chocolate,GIRONES,2025-01-14,,,
Caldo de costilla FRESCAMPO 8 cubos (92 gr),$ 2.070,Gr a $ 22,92 gr,Caldo,FRESCAMPO,2025-01-14,,,
Galletas navidad NOEL cofre tambor (780 gr),$ 59.900,Gr a $ 76,780 gr,Galletas,NOEL,2025-01-14,,,
Ancheta Dulce Navidad,$ 75.900,Und a $ 75.900,,Ancheta,,2025-01-14,,,
Té en polvo SUNTEA sabor a durazno (12 gr),$ 1.630,Gr a $ 135,12 gr,Té,SUNTEA,2025-01-14,,,
Sal REFISAL baja en sodio con potasio (800 gr),$ 8.850,Gr a $ 11,800 gr,Sal,REFISAL,2025-01-14,,,
Galletas TOSH Wafer cacao (180 gr),$ 10.400,Gr a $ 57,180 gr,Galletas,TOSH,2025-01-14,,,
Caldo de costilla FRESCAMPO 12 cubos (138 gr),$ 2.990,Gr a $ 21,138 gr,Caldo,FRESCAMPO,2025-01-14,,,
Salsa Para Pasta BARILLA MARCA EXCLUSIVA Basilico (400 gr),$ 14.900,Gr a $ 37,400 gr,Salsa,BARILLA MARCA EXCLUSIVA,2025-01-14,,,
Avena Hojuela TONING 1000 gr,$ 10.250,Gr a $ 10,,Avena,TONING,2025-01-14,,,
Bebida en polvo MILO a base de malta y cocoa doypack (1500 gr),$ 59.000,Gr a $ 39,1500 gr,Bebida,MILO,2025-01-14,,,
Pimienta EL REY (60 gr),$ 3.740,Gr a $ 62,60 gr,Pimienta,EL REY,2025-01-14,,,
MAGGI MAGGI CHAMPI?ONES (58 gr),$ 3.430,Gr a $ 59,58 gr,MAGGI,MAGGI MAGGI CHAMPI?ONES,2025-01-14,,,
MAGGI MAGGI TOMATE (61 gr),$ 3.450,Gr a $ 56,61 gr,MAGGI,MAGGI MAGGI TOMATE,2025-01-14,,,
Pasta De Tomate FRUCO Doy Pack Baja En Sal (200 gr),$ 8.440,Gr a $ 42,200 gr,Pasta,FRUCO,2025-01-14,,,
Refresco en polvo FRUTINO sabor a mango de azúcar (10 gr),$ 1.080,Gr a $ 108,10 gr,Refresco,FRUTINO,2025-01-14,,,
Pimienta EL REY Pura (25 gr),$ 2.150,Gr a $ 86,25 gr,Pimienta,EL REY,2025-01-14,,,
MAGGI MAGGI AJIACO (60 gr),$ 2.590,Gr a $ 43,60 gr,MAGGI,MAGGI MAGGI AJIACO,2025-01-14,,,
MAZAMORRA LA ANTIOQUENA (500 gr),$ 2.780,Gr a $ 5,500 gr,MAZAMORRA,MAZAMORRA LA ANTIOQUENA,2025-01-14,,,
MAGGI MAGGI MARINERA (56 gr),$ 3.430,Gr a $ 61,56 gr,MAGGI,MAGGI MAGGI MARINERA,2025-01-14,,,
Infusión TOSH Frutos rojos x20 und (24 gr),$ 9.220,Gr a $ 384,24 gr,Infusión,TOSH,2025-01-14,,,
Harina FRESCAMPO de maíz blanco (500 gr),$ 1.990,Gr a $ 3,500 gr,Harina,FRESCAMPO,2025-01-14,,,
Pasta CONZAZONI spaghetti #12 (1000 gr),$ 11.750,Gr a $ 11,1000 gr,Pasta,CONZAZONI,2025-01-14,,,
Chocolate CORONA Con azúcar pastillas (250 gr),$ 9.100,Gr a $ 36,250 gr,Chocolate,CORONA,2025-01-14,,,
PANELA MINI COQUITO LA CHINCA 660 gr,$ 4.800,Gr a $ 7,,PANELA,PANELA MINI COQUITO LA CHINCA,2025-01-14,,,
Café MATIZ saborizado baileys (240 gr),$ 20.400,Gr a $ 85,240 gr,Café,MATIZ,2025-01-14,,,
Galletas TOSH De avena con manzana y maní x6 und (180 gr),$ 11.950,Gr a $ 66,180 gr,Galletas,TOSH,2025-01-14,,,
Colada MAIZENA Sabor Arequipe (28 gr),$ 2.010,Gr a $ 71,28 gr,Colada,MAIZENA,2025-01-14,,,
AVENA MOLIDA QUAKER 350 gr,$ 8.590,Gr a $ 24,,AVENA,AVENA MOLIDA QUAKER,2025-01-14,,,
Ajo BADIA Polvo (85.05 gr),$ 13.600,Gr a $ 159,85.05 gr,Ajo,BADIA,2025-01-14,,,
Café CAFE QUINDIO gourmet tostado y molido (454 gr),$ 34.250,Gr a $ 75,454 gr,Café,CAFE QUINDIO,2025-01-14,,,
Salsa Pesto BARILLA MARCA EXCLUSIVA Con Basilico Italiano (190 gr),$ 19.900,Gr a $ 104,190 gr,Salsa,BARILLA MARCA EXCLUSIVA,2025-01-14,,,
Harina FRESCAMPO de maíz amarillo (1000 gr),$ 2.540,Gr a $ 2,1000 gr,Harina,FRESCAMPO,2025-01-14,,,
arroz CASTELLANO BLANCO (4000 gr),$ 45.350,Gr a $ 11,4000 gr,arroz,CASTELLANO BLANCO,2025-01-14,,,
GALLETAS OREO GALLETAS (262.4 gr),$ 17.900,Gr a $ 68,262.4 gr,GALLETAS,GALLETAS OREO GALLETAS,2025-01-14,,,
Galletas CLUB SOCIAL multicereal x9und (234 gr),$ 7.320,Gr a $ 31,234 gr,Galletas,CLUB SOCIAL,2025-01-14,,,
Café JUAN VALDEZ Liofilizado clásico (95 gr),$ 28.600,Gr a $ 301,95 gr,Café,JUAN VALDEZ,2025-01-14,,,
Galletas TOSH Tipo sandwich cremadas vainilla (144 gr),$ 8.880,Gr a $ 61,144 gr,Galletas,TOSH,2025-01-14,,,
Maíz FRESCAMPO granos seleccionados (1000 gr),$ 3.700,Gr a $ 3,1000 gr,Maíz,FRESCAMPO,2025-01-14,,,
Galletas OREO Chocolate x6 paquetes (216 gr),$ 8.080,Gr a $ 37,216 gr,Galletas,OREO,2025-01-14,,,
Tortillas TIA ROSA De Maíz x10und (210 gr),$ 7.420,Gr a $ 35,210 gr,Tortillas,TIA ROSA,2025-01-14,,,
Crema Avellanas NUTELLA (200 gr),$ 17.800,Gr a $ 89,200 gr,Crema,NUTELLA,2025-01-14,,,
Arroz ROA (1000 gr),$ 5.070,Gr a $ 5,1000 gr,Arroz,ROA,2025-01-14,,,
Arroz DONA PEPA (3000 gr),$ 18.550,Gr a $ 6,3000 gr,Arroz,DONA PEPA,2025-01-14,,,
Aceite OLEOCALI girasol (900 ml),$ 15.000,Cm3 a $ 16,900 ml,Aceite,OLEOCALI,2025-01-14,,,
Panela Ekono 2 Und EKONO 1000 gr,$ 4.990,Gr a $ 4,,Panela,EKONO,2025-01-14,,,
Sazonador FRESCAMPO completo (50 gr),$ 2.160,Gr a $ 43,50 gr,Sazonador,FRESCAMPO,2025-01-14,,,
Crema de pollo con verduras LA SOPERA en sobre (43 gr),$ 1.600,Gr a $ 37,43 gr,Crema,LA SOPERA,2025-01-14,,,
Salsa LA CONSTANCIA Mostaneza (190 gr),$ 7.470,Gr a $ 39,190 gr,Salsa,LA CONSTANCIA,2025-01-14,,,
Galletas EXITO MARCA PROPIA cremadas sabor a fresa (408 gr),$ 7.490,Gr a $ 18,408 gr,Galletas,EXITO MARCA PROPIA,2025-01-14,,,
Pescado en conserva VAN CAMPS En salsa de tomate (276 gr),$ 11.450,Gr a $ 41,276 gr,Pescado,VAN CAMPS,2025-01-14,,,
Sardina LA SOBERANA Conserva Tinapa Bocado Tomate (80 gr),$ 4.150,Gr a $ 51,80 gr,Sardina,LA SOBERANA,2025-01-14,,,
Condimento TRIGUISAR GRAN COCINA COMPLETO (40 gr),$ 2.250,Gr a $ 56,40 gr,Condimento,TRIGUISAR GRAN COCINA COMPLETO,2025-01-14,,,
Salsa ADEREZOS De Soya Sazonadora (1050 gr),$ 15.900,Gr a $ 15,1050 gr,Salsa,ADEREZOS,2025-01-14,,,
Pasta EKONO fideos (1000 gr),$ 4.950,Gr a $ 4,1000 gr,Pasta,EKONO,2025-01-14,,,
Panela Redonda X 8 unidades EKONO 1000 gr,$ 5.560,Gr a $ 5,,Panela,X EKONO,2025-01-14,,,
Chocolate EKONO tradicional (500 gr),$ 10.980,Gr a $ 21,500 gr,Chocolate,EKONO,2025-01-14,,,
Mostaza COLMANS tarrina (200 gr),$ 9.980,Gr a $ 49,200 gr,Mostaza,COLMANS,2025-01-14,,,
Pasta EKONO conchas (400 gr),$ 1.910,Gr a $ 4,400 gr,Pasta,EKONO,2025-01-14,,,
Pasta BARILLA MARCA EXCLUSIVA (500 gr),$ 8.460,Gr a $ 16,500 gr,Pasta,BARILLA MARCA EXCLUSIVA,2025-01-14,,,
Mayonesa FRUCO Doypack (1000 gr),$ 24.550,Gr a $ 24,1000 gr,Mayonesa,FRUCO,2025-01-14,,,
Precio Esp Gelatina FresaSand FRUTINO 42 gr,$ 5.260,Gr a $ 125,,Precio,FRUTINO,2025-01-14,,,
Café LA BASTILLA tostado y molido (450 gr),$ 15.950,Gr a $ 35,450 gr,Café,LA BASTILLA,2025-01-14,,,
Pastas DORIA spaghetti sin gluten (250 gr),$ 7.340,Gr a $ 29,250 gr,Pastas,DORIA,2025-01-14,,,
Pasta BARILLA MARCA EXCLUSIVA (500 gr),$ 10.000,Gr a $ 20,500 gr,Pasta,BARILLA MARCA EXCLUSIVA,2025-01-14,,,
Salsa De Tomate FRUCO Doy Pack (190 gr),$ 5.810,Gr a $ 30,190 gr,Salsa,FRUCO,2025-01-14,,,
Galletas SALTIN NOEL Tradicional x4 tacos (354 gr),$ 7.830,Gr a $ 22,354 gr,Galletas,SALTIN NOEL,2025-01-14,,,
Salsa LA CONSTANCIA Mostaneza (380 gr),$ 13.450,Gr a $ 35,380 gr,Salsa,LA CONSTANCIA,2025-01-14,,,
Caldo de gallina FRESCAMPO criolla 8 cubos (92 gr),$ 1.860,Gr a $ 20,92 gr,Caldo,FRESCAMPO,2025-01-14,,,
Anis PRODUCTOS DEL RIO (14 gr),$ 5.750,Gr a $ 410,14 gr,Anis,PRODUCTOS DEL RIO,2025-01-14,,,
Salsa Para Pasta BARILLA MARCA EXCLUSIVA Boloñesa (400 gr),$ 27.500,Gr a $ 68,400 gr,Salsa,BARILLA MARCA EXCLUSIVA,2025-01-14,,,
Chocolate de mesa CORONA Tradicional (500 gr),$ 17.600,Gr a $ 35,500 gr,Chocolate,CORONA,2025-01-14,,,
Crema de tomate LA SOPERA en sobre (56 gr),$ 1.750,Gr a $ 31,56 gr,Crema,LA SOPERA,2025-01-14,,,
Caldo de costilla EKONO x8 cubos (92 gr),$ 1.830,Gr a $ 19,92 gr,Caldo,EKONO,2025-01-14,,,
Pasta BARILLA MARCA EXCLUSIVA (500 gr),$ 9.000,Gr a $ 18,500 gr,Pasta,BARILLA MARCA EXCLUSIVA,2025-01-14,,,
Crema de maní TOSH Sin azúcar (300 gr),$ 18.000,Gr a $ 60,300 gr,Crema,TOSH,2025-01-14,,,
Aceite de oliva HACIENDA GUZMAN MARCA EXCLUSIV extra virgen gran selección (1000 ml),$ 66.400,Cm3 a $ 66,1000 ml,Aceite,HACIENDA GUZMAN MARCA EXCLUSIV,2025-01-14,,,
Crema de pollo LA SOPERA en sobre (42.5 gr),$ 1.750,Gr a $ 41,42.5 gr,Crema,LA SOPERA,2025-01-14,,,
Salsa LA CONSTANCIA Mostaza (190 gr),$ 7.620,Gr a $ 40,190 gr,Salsa,LA CONSTANCIA,2025-01-14,,,
GELATINA PINA CAJA DIETY 13 gr,$ 3.200,Gr a $ 246,,GELATINA,GELATINA PINA CAJA DIETY,2025-01-14,,,
Syrup AUNT JEMIMA (355 ml),$ 21.500,Ml a $ 60,355 ml,Syrup,AUNT JEMIMA,2025-01-14,,,
Café BUENDIA Descafeinado (85 gr),$ 17.750,Gr a $ 208,85 gr,Café,BUENDIA,2025-01-14,,,
Vinagre FRUCO Blanco (500 ml),$ 7.110,Ml a $ 14,500 ml,Vinagre,FRUCO,2025-01-14,,,
Infusión HINDU Frutos Tropicales (20 gr),$ 12.350,Gr a $ 617,20 gr,Infusión,HINDU,2025-01-14,,,
Pasta Corriente DORIA 500 gr,$ 4.100,Gr a $ 8,,Pasta,DORIA,2025-01-14,,,
Caldo de gallina MAGGI x48 cubos (528 gr),$ 20.450,Gr a $ 38,528 gr,Caldo,MAGGI,2025-01-14,,,
Café SELLO ROJO Tradicional (1000 gr),$ 39.650,Gr a $ 39,1000 gr,Café,SELLO ROJO,2025-01-14,,,
Mezcla HAZ DE OROS para buñuelos (300 gr),$ 8.500,Gr a $ 28,300 gr,Mezcla,HAZ DE OROS,2025-01-14,,,
Bebida NESQUIK Chocolate (200 gr),$ 6.780,Gr a $ 33,200 gr,Bebida,NESQUIK,2025-01-14,,,
Harina PROMASA (1000 gr),$ 3.430,Gr a $ 3,1000 gr,Harina,PROMASA,2025-01-14,,,
Salsa LA CONSTANCIA Mostaneza del rancho (190 gr),$ 8.880,Gr a $ 46,190 gr,Salsa,LA CONSTANCIA,2025-01-14,,,
VINAGRETA ADEREZOS Original Para Ensaladas (270 gr),$ 11.350,Gr a $ 42,270 gr,VINAGRETA,VINAGRETA ADEREZOS,2025-01-14,,,
Ancheta Prestigio,$ 99.850,Und a $ 99.850,,Ancheta,,2025-01-14,,,
Cereal CHOCO KRISPIS Choco Krispis Chocolate (360 gr),$ 19.750,Gr a $ 54,360 gr,Cereal,CHOCO KRISPIS,2025-01-14,,,
Arvejas Zanahoria Y Maiz TO EAT MARCA EXCLUSIVA Arvejas Y Zanahoria (180 gr),$ 3.990,Gr a $ 22,180 gr,Arvejas,Y TO EAT MARCA EXCLUSIVA Y,2025-01-14,,,
Azúcar MAYAGUEZ (2500 gr),$ 11.700,Gr a $ 4,2500 gr,Azúcar,MAYAGUEZ,2025-01-14,,,
Sal REFISAL rosada del himalaya (400 gr),$ 17.750,Gr a $ 44,400 gr,Sal,REFISAL,2025-01-14,,,
Pasta DORIA Tornillos (250 gr),$ 2.050,Gr a $ 8,250 gr,Pasta,DORIA,2025-01-14,,,
Cereal NESTLE sin gluten caja (405 gr),$ 14.900,Gr a $ 36,405 gr,Cereal,NESTLE,2025-01-14,,,
Salsa Con Ajo SAN JORGE 200 gr,$ 7.980,Gr a $ 39,,Salsa,SAN JORGE,2025-01-14,,,
Aromatica Albahaca FRESCAMPO 15 gr,$ 2.190,Gr a $ 146,,Aromatica,FRESCAMPO,2025-01-14,,,
Arroz PINILLAR (500 gr),$ 2.250,Gr a $ 4,500 gr,Arroz,PINILLAR,2025-01-14,,,
Aceite CANOLA LIFE Canola (3000 ml),$ 72.000,Ml a $ 24,3000 ml,Aceite,CANOLA LIFE,2025-01-14,,,
Café LA BASTILLA fuerte (390 gr),$ 14.250,Gr a $ 36,390 gr,Café,LA BASTILLA,2025-01-14,,,
Arroz CASTELLANO (500 gr),$ 5.400,Gr a $ 10,500 gr,Arroz,CASTELLANO,2025-01-14,,,
Natilla MAIZENA Sabor Arequipe (300 gr),$ 9.990,Gr a $ 33,300 gr,Natilla,MAIZENA,2025-01-14,,,
Frijol FRESCAMPO granos seleccionados (500 gr),$ 3.280,Gr a $ 6,500 gr,Frijol,FRESCAMPO,2025-01-14,,,
Pasta TAEQ spaghetti de arroz libre de gluten (250 gr),$ 7.040,Gr a $ 28,250 gr,Pasta,TAEQ,2025-01-14,,,
Salsa BBQ BARY Botella (470 gr),$ 10.000,Gr a $ 21,470 gr,Salsa,BBQ BARY,2025-01-14,,,
Galletas FESTIVAL Chocolate x12und (403 gr),$ 11.850,Gr a $ 29,403 gr,Galletas,FESTIVAL,2025-01-14,,,
Café COLCAFE suave clásico (170 gr),$ 22.250,Gr a $ 130,170 gr,Café,COLCAFE,2025-01-14,,,
Café CAFE QUINDIO gourmet (250 gr),$ 22.000,Gr a $ 88,250 gr,Café,CAFE QUINDIO,2025-01-14,,,
Café SELLO ROJO Molido fuerte (600 gr),$ 23.250,Gr a $ 38,600 gr,Café,SELLO ROJO,2025-02-07,$ 24.450,https://www.exito.com/cafe-fuerte-tostado-y-molido-x-600-gr-576815/p,https://www.exito.com/cafe-fuerte-tostado-y-molido-x-600-gr-576815/p
Chocolate de mesa CORONA TRADICIONAL PASTILLADO (450 gr),$ 15.950,Gr a $ 35,450 gr,Chocolate,CORONA TRADICIONAL PASTILLADO,2025-02-07,$ 16.500,https://www.exito.com/chocolate-de-mesa-corona-tradicional-pastillado-450-gr-3190994/p,https://www.exito.com/chocolate-de-mesa-corona-tradicional-pastillado-450-gr-3190994/p
Café AGUILA ROJA (500 gr),$ 20.100,Gr a $ 40,500 gr,Café,AGUILA ROJA,2025-02-07,$ 20.800,https://www.exito.com/cafe-molido-500-gr-50368/p,https://www.exito.com/cafe-molido-500-gr-50368/p
Café EXITO MARCA PROPIA tostado y molido (500 gr),$ 16.900,Gr a $ 33,500 gr,Café,EXITO MARCA PROPIA,2025-02-07,,https://www.exito.com/caf-molido-x-500-gr-34378/p,https://www.exito.com/caf-molido-x-500-gr-34378/p
Chocolate de mesa LA ESPECIAL pastillado con azúcar (400 gr),$ 11.750,Gr a $ 29,400 gr,Chocolate,LA ESPECIAL,2025-02-07,$ 12.500,https://www.exito.com/chocolate-de-mesa-pastillado-con-azucar-la-especial-400-gr-3158742/p,https://www.exito.com/chocolate-de-mesa-pastillado-con-azucar-la-especial-400-gr-3158742/p
Café JUAN VALDEZ Colina molido (454 gr),$ 34.000,Gr a $ 74,454 gr,Café,JUAN VALDEZ,2025-02-07,"-
23
%
$ 44.300",https://www.exito.com/cafe-tostado-molido-juan-valdez-454-gr-3022702/p,https://www.exito.com/cafe-tostado-molido-juan-valdez-454-gr-3022702/p
Café LUKAFE tostado y molido intenso (600 gr),$ 18.900,Gr a $ 31,600 gr,Café,LUKAFE,2025-02-07,,https://www.exito.com/cafe-molido-lukafe-intenso-600g-lukafe-600-gr-3160465/p,https://www.exito.com/cafe-molido-lukafe-intenso-600g-lukafe-600-gr-3160465/p
Café instantáneo NESCAFE TRADICIÓN (231 gr),$ 30.800,Gr a $ 133,231 gr,Café,NESCAFE TRADICIÓN,2025-02-07,,https://www.exito.com/cafe-tradicion-lata-nescafe-231-gr-3026605/p,https://www.exito.com/cafe-tradicion-lata-nescafe-231-gr-3026605/p
Chocolate en polvo LYNE Endulzado (200 gr),$ 14.320,Gr a $ 71,200 gr,Chocolate,LYNE,2025-02-07,"-
20
%
$ 17.900",https://www.exito.com/cacao-en-polvo-clasico-endulzado-lyne-200-gr-3122837/p,https://www.exito.com/cacao-en-polvo-clasico-endulzado-lyne-200-gr-3122837/p
Café SELLO ROJO Molido (400 gr),$ 14.800,Gr a $ 37,400 gr,Café,SELLO ROJO,2025-02-07,$ 16.300,https://www.exito.com/cafe-molido-872064/p,https://www.exito.com/cafe-molido-872064/p
Cafe TOSTAO Tostado y Molido (454 gr),$ 14.520,Gr a $ 31,454 gr,Cafe,TOSTAO,2025-02-07,"-
20
%
$ 18.150",https://www.exito.com/cafe-tostao-tostado-y-molido-454-gr-3178996/p,https://www.exito.com/cafe-tostao-tostado-y-molido-454-gr-3178996/p
Chocolate SOL de mesa tradicional en pasta (500 gr),$ 14.900,Gr a $ 29,500 gr,Chocolate,SOL,2025-02-07,,https://www.exito.com/chocolate-con-azucar-15727/p,https://www.exito.com/chocolate-con-azucar-15727/p
Café MATIZ tostión oscura y molienda gruesa (340 gr),$ 24.300,Gr a $ 71,340 gr,Café,MATIZ,2025-02-07,$ 25.550,https://www.exito.com/cafe-escarlata-tostado-y-molido-x-340-gr-893454/p,https://www.exito.com/cafe-escarlata-tostado-y-molido-x-340-gr-893454/p
Café instantáneo NESCAFE TRADICIÓN (50 gr),$ 9.260,Gr a $ 185,50 gr,Café,NESCAFE TRADICIÓN,2025-02-07,,https://www.exito.com/nescafe-tradicional-frasco-50-gr-67488/p,https://www.exito.com/nescafe-tradicional-frasco-50-gr-67488/p
Café instantáneo NESCAFE TRADICIÓN (170 gr),$ 27.000,Gr a $ 158,170 gr,Café,NESCAFE TRADICIÓN,2025-02-07,,https://www.exito.com/nescafe-granuladox170-gramos-114962/p,https://www.exito.com/nescafe-granuladox170-gramos-114962/p
Chocolate SOL 50% menos azúcar (320 gr),$ 15.550,Gr a $ 48,320 gr,Chocolate,SOL,2025-02-07,,https://www.exito.com/sol-50-menos-azucar-624033/p,https://www.exito.com/sol-50-menos-azucar-624033/p
Café EKONO tostado y molido (500 gr),$ 13.940,Gr a $ 27,500 gr,Café,EKONO,2025-02-07,,https://www.exito.com/cafe-molido-ekono-x-500-gr-444791/p,https://www.exito.com/cafe-molido-ekono-x-500-gr-444791/p
Crema no láctea INSTACREM original (144 gr),$ 9.130,Gr a $ 63,144 gr,Crema,INSTACREM,2025-02-07,,https://www.exito.com/instacrem-caja-x-36-sobres-15887/p,https://www.exito.com/instacrem-caja-x-36-sobres-15887/p
Café JUAN VALDEZ Liofilizado avellana (95 gr),$ 27.600,Gr a $ 290,95 gr,Café,JUAN VALDEZ,2025-02-07,,https://www.exito.com/cafe-juan-valdez-liofilizado-avellana-x-95-gr-44077/p,https://www.exito.com/cafe-juan-valdez-liofilizado-avellana-x-95-gr-44077/p
Café MATIZ tostión media y molienda media (340 gr),$ 25.050,Gr a $ 73,340 gr,Café,MATIZ,2025-02-07,$ 26.350,https://www.exito.com/cafe-ambar-tostado-y-molido-x-340-gr-893453/p,https://www.exito.com/cafe-ambar-tostado-y-molido-x-340-gr-893453/p
Café SELLO ROJO tostado y molido (250 gr),$ 10.550,Gr a $ 42,250 gr,Café,SELLO ROJO,2025-02-07,$ 10.650,https://www.exito.com/cafe-molido-34895/p,https://www.exito.com/cafe-molido-34895/p
Café BUENDIA Liofilizado (170 gr),$ 28.100,Gr a $ 165,170 gr,Café,BUENDIA,2025-02-07,,https://www.exito.com/cafe-buen-dia-liofilizado-170-gr-318955/p,https://www.exito.com/cafe-buen-dia-liofilizado-170-gr-318955/p
