Producto,Precio,Precio_Unidad,Peso,Categoria,Marca,Fecha,Precio_Promocion,Link,link
Pasta BARILLA MARCA EXCLUSIVA (500 gr),$ 8.460,Gr a $ 16,500 gr,Pasta,BARILLA MARCA EXCLUSIVA,2025-01-14,,,
Sardina LA SOBERANA Conserva En Salsa De Tomate (280 gr),$ 10.500,Gr a $ 37,280 gr,Sardina,LA SOBERANA,2025-01-14,,,
Pimienta EL REY Pura (25 gr),$ 2.150,Gr a $ 86,25 gr,Pimienta,EL REY,2025-01-14,,,
Café LA BASTILLA tostado y molido (450 gr),$ 15.950,Gr a $ 35,450 gr,Café,LA BASTILLA,2025-01-14,,,
Pasta BARILLA MARCA EXCLUSIVA (500 gr),$ 10.000,Gr a $ 20,500 gr,Pasta,BARILLA MARCA EXCLUSIVA,2025-01-14,,,
Crema de maní TOSH Sin azúcar (300 gr),$ 18.000,Gr a $ 60,300 gr,Crema,TOSH,2025-01-14,,,
Café LA BASTILLA fuerte (390 gr),$ 14.250,Gr a $ 36,390 gr,Café,LA BASTILLA,2025-01-14,,,
Sal REFISAL alta pureza (1000 gr),$ 2.520,Gr a $ 2,1000 gr,Sal,REFISAL,2025-01-15,,,
Galletas SALTIN NOEL Tradicional x6 tacos (531 gr),$ 9.520,Gr a $ 17,531 gr,Galletas,SALTIN NOEL,2025-01-15,,,
Café SELLO ROJO Molido fuerte (600 gr),$ 24.450,Gr a $ 40,600 gr,Café,SELLO ROJO,2025-01-15,,,
Aceite EXITO MARCA PROPIA de girasol (900 ml),$ 7.880,Ml a $ 8,900 ml,Aceite,EXITO MARCA PROPIA,2025-01-15,,,
Arroz DIANA (1000 gr),$ 6.820,Gr a $ 6,1000 gr,Arroz,DIANA,2025-01-15,,,
Caldo de Gallina MAGGI Desmenuzado paga 12 lleva 14 (108 gr),$ 5.440,Gr a $ 50,108 gr,Caldo,MAGGI,2025-01-15,,,
Galletas DUCALES x5 tacos (500 gr),$ 13.100,Gr a $ 26,500 gr,Galletas,DUCALES,2025-01-15,,,
Spaguetti DORIA Clásico (1000 gr),$ 5.592,Gr a $ 5,1000 gr,Spaguetti,DORIA,2025-01-15,,,
Atún VAN CAMPS En aceite de girasol (416 gr),$ 35.700,Gr a $ 85,416 gr,Atún,VAN CAMPS,2025-01-15,,,
Azúcar MANUELITA (1000 gr),$ 5.890,Gr a $ 5,1000 gr,Azúcar,MANUELITA,2025-01-15,,,
Aceite GOURMET multiusos (900 ml),$ 20.650,Ml a $ 22,900 ml,Aceite,GOURMET,2025-01-15,,,
Lomos Atun ZENU Aceite de girasol (104 gr),$ 7.040,Gr a $ 67,104 gr,Lomos,ZENU,2025-01-15,,,
Café JUAN VALDEZ Colina molido (454 gr),$ 35.450,Gr a $ 78,454 gr,Café,JUAN VALDEZ,2025-01-15,,,
Chocolate de mesa CORONA TRADICIONAL PASTILLADO (450 gr),$ 16.500,Gr a $ 36,450 gr,Chocolate,CORONA TRADICIONAL PASTILLADO,2025-01-15,,,
Azucar MANUELITA (2000 gr),$ 7.760,Gr a $ 3,2000 gr,Azucar,MANUELITA,2025-01-15,,,
Tortillas BIMBO Tradicional Tamaño M x15und (450 gr),$ 13.300,Gr a $ 29,450 gr,Tortillas,BIMBO M,2025-01-15,,,
Café MATIZ tostión oscura y molienda gruesa (340 gr),$ 25.550,Gr a $ 75,340 gr,Café,MATIZ,2025-01-15,,,
Atún VAN CAMPS En agua natural (156 gr),$ 11.560,Gr a $ 74,156 gr,Atún,VAN CAMPS,2025-01-15,,,
Atún VAN CAMPS En agua natural (416 gr),$ 33.800,Gr a $ 81,416 gr,Atún,VAN CAMPS,2025-01-15,,,
Frijol DIANA (500 gr),$ 6.150,Gr a $ 12,500 gr,Frijol,DIANA,2025-01-15,,,
Salsa De Tomate FRUCO Doy Pack (600 gr),$ 10.590,Gr a $ 17,600 gr,Salsa,FRUCO,2025-01-15,,,
Café instantáneo NESCAFE TRADICIÓN (170 gr),$ 24.600,Gr a $ 144,170 gr,Café,NESCAFE TRADICIÓN,2025-01-15,,,
Café instantáneo NESCAFE TRADICIÓN (231 gr),$ 26.550,Gr a $ 114,231 gr,Café,NESCAFE TRADICIÓN,2025-01-15,,,
Salsa MAGGI bechamel (50 gr),$ 4.580,Gr a $ 91,50 gr,Salsa,MAGGI,2025-01-15,,,
Salsa LA CONSTANCIA Tomate (1000 gr),$ 18.450,Gr a $ 18,1000 gr,Salsa,LA CONSTANCIA,2025-01-15,,,
Salsa MAGGI bolognesa (50 gr),$ 4.210,Gr a $ 84,50 gr,Salsa,MAGGI,2025-01-15,,,
Gelatina Sin Azúcar Sabor Mora TAEQ 11 gr,$ 1.680,Gr a $ 152,,Gelatina,TAEQ,2025-01-15,,,
MILO MILO ACTIVGP (590 gr),$ 26.650,Gr a $ 45,590 gr,MILO,MILO MILO ACTIVGP,2025-01-15,,,
Gelatina Sin Azúcar Sabor Cereza TAEQ 11 gr,$ 1.680,Gr a $ 152,,Gelatina,TAEQ,2025-01-15,,,
Café instantáneo NESCAFE TRADICIÓN (50 gr),$ 8.490,Gr a $ 169,50 gr,Café,NESCAFE TRADICIÓN,2025-01-15,,,
Cereal CHOCO KRISPIS Choco Krispis Chocolate (570 gr),$ 27.550,Gr a $ 48,570 gr,Cereal,CHOCO KRISPIS,2025-01-15,,,
Paprika EL REY Pura (25 gr),$ 1.700,Gr a $ 68,25 gr,Paprika,EL REY,2025-01-15,,,
Maíz ZENU lata x2und sin azúcar añadido (298 gr),$ 10.625,Gr a $ 35,298 gr,Maíz,ZENU,2025-01-15,,,
Pasta de tomate LA CONSTANCIA Doy pack (200 gr),$ 9.420,Gr a $ 47,200 gr,Pasta,LA CONSTANCIA,2025-01-15,,,
Cereal ZUCARITAS Zucaritas Original (610 gr),$ 27.550,Gr a $ 45,610 gr,Cereal,ZUCARITAS,2025-01-15,,,
Azucar RIOPAILA (1000 gr),$ 5.040,Gr a $ 5,1000 gr,Azucar,RIOPAILA,2025-01-15,,,
Aceite PREMIER comestible girasol (900 ml),$ 18.450,Ml a $ 20,900 ml,Aceite,PREMIER,2025-01-15,,,
Galletas DUCALES x9 paquetes (243 gr),$ 7.690,Gr a $ 31,243 gr,Galletas,DUCALES,2025-01-15,,,
PANELA PASTILLA FONCE 900 gr,$ 11.500,Gr a $ 12,,PANELA,PANELA PASTILLA FONCE,2025-01-15,,,
Atún ZENU en agua (104 gr),$ 7.040,Gr a $ 67,104 gr,Atún,ZENU,2025-01-15,,,
Mayonesa FRUCO Baja en Grasa (600 gr),$ 12.390,Gr a $ 20,600 gr,Mayonesa,FRUCO,2025-01-15,,,
Café SELLO ROJO tostado y molido (250 gr),$ 11.200,Gr a $ 44,250 gr,Café,SELLO ROJO,2025-01-15,,,
Atún VAN CAMPS En aceite de girasol (104 gr),$ 9.070,Gr a $ 87,104 gr,Atún,VAN CAMPS,2025-01-15,,,
Maíz tierno SAN JORGE Lata x2 und (230 gr),$ 11.250,Gr a $ 48,230 gr,Maíz,SAN JORGE,2025-01-15,,,
Café MATIZ tostión media y molienda media (340 gr),$ 25.550,Gr a $ 75,340 gr,Café,MATIZ,2025-01-15,,,
Mostaza COLMANS doy pack (200 gr),$ 5.930,Gr a $ 29,200 gr,Mostaza,COLMANS,2025-01-15,,,
Salsa LA CONSTANCIA Piña (200 gr),$ 6.050,Gr a $ 30,200 gr,Salsa,LA CONSTANCIA,2025-01-15,,,
Café JUAN VALDEZ Liofilizado clásico doypack (250 gr),$ 54.300,Gr a $ 217,250 gr,Café,JUAN VALDEZ,2025-01-15,,,
Galletas TOSH Tipo sandwich cremadas chocolate (144 gr),$ 9.580,Gr a $ 66,144 gr,Galletas,TOSH,2025-01-15,,,
Arroz TAEQ integral (1000 gr),$ 5.160,Gr a $ 5,1000 gr,Arroz,TAEQ,2025-01-15,,,
Gelatina Sin Azúcar Sabor Fresa TAEQ 11 gr,$ 1.680,Gr a $ 152,,Gelatina,TAEQ,2025-01-15,,,
Atun ISABEL (104 gr),$ 9.040,Gr a $ 86,104 gr,Atun,ISABEL,2025-01-15,,,
Caldo con costilla MAGGI Desmenuzado paga 10 lleva 12 (90 gr),$ 5.050,Gr a $ 56,90 gr,Caldo,MAGGI,2025-01-15,,,
Mermelada SAN JORGE De frutos rojos (200 gr),$ 5.130,Gr a $ 25,200 gr,Mermelada,SAN JORGE,2025-01-15,,,
Atún VAN CAMPS En agua natural (104 gr),$ 8.580,Gr a $ 82,104 gr,Atún,VAN CAMPS,2025-01-15,,,
Pasta LA MUNECA corta letras (250 gr),$ 2.160,Gr a $ 8,250 gr,Pasta,LA MUNECA,2025-01-15,,,
Aceite CANOLA LIFE canola (1000 ml),$ 27.450,Cm3 a $ 27,1000 ml,Aceite,CANOLA LIFE,2025-01-15,,,
Salsa BBQ BARY Doypack (400 gr),$ 10.100,Gr a $ 25,400 gr,Salsa,BBQ BARY,2025-01-15,,,
Frijol FRESCAMPO granos seleccionados (1000 gr),$ 9.970,Gr a $ 9,1000 gr,Frijol,FRESCAMPO,2025-01-15,,,
Gelatina Sin Azúcar Sabor Limón TAEQ 11 gr,$ 1.680,Gr a $ 152,,Gelatina,TAEQ,2025-01-15,,,
Cereal FROOT LOOPS Froot Loops Frutal (450 gr),$ 30.450,Gr a $ 67,450 gr,Cereal,FROOT LOOPS,2025-01-15,,,
Salsa LA CONSTANCIA BBQ (400 gr),$ 11.350,Gr a $ 28,400 gr,Salsa,LA CONSTANCIA BBQ,2025-01-15,,,
Galletas RITZ Rellenas de Crema Sabor Queso x6paq (180 gr),$ 10.600,Gr a $ 58,180 gr,Galletas,RITZ,2025-01-15,,,
Café Descafeinado NESCAFE DECAF instantáneo (100 gr),$ 15.600,Gr a $ 156,100 gr,Café,NESCAFE DECAF,2025-01-15,,,
Tortillas TIA ROSA De Trigo x12und (300 gr),$ 6.550,Gr a $ 21,300 gr,Tortillas,TIA ROSA,2025-01-15,,,
Azúcar Orgánica MANUELITA (800 gr),$ 5.760,Gr a $ 7,800 gr,Azúcar,MANUELITA,2025-01-15,,,
Harina PAN (500 gr),$ 2.700,Gr a $ 5,500 gr,Harina,PAN,2025-01-15,,,
Arroz FEDERAL Premium alto rendimiento (2500 gr),$ 18.650,Gr a $ 7,2500 gr,Arroz,FEDERAL,2025-01-15,,,
AVENA EN HOJUELAS QUAKER 400 gr,$ 5.100,Gr a $ 12,,AVENA,AVENA EN HOJUELAS QUAKER,2025-01-15,,,
"Aromática TOSH Manzanilla, jengibre, limón y miel (22 gr)",$ 8.910,Gr a $ 405,22 gr,Aromática,TOSH,2025-01-15,,,
Tricompleto EL REY (55 gr),$ 1.990,Gr a $ 36,55 gr,Tricompleto,EL REY,2025-01-15,,,
Café MATIZ tostión media y molienda gruesa (340 gr),$ 26.400,Gr a $ 77,340 gr,Café,MATIZ,2025-01-15,,,
Salsa LA CONSTANCIA Mayonesa (190 gr),$ 5.980,Gr a $ 31,190 gr,Salsa,LA CONSTANCIA,2025-01-15,,,
Galletas navidad NOEL cofre tambor (780 gr),$ 59.900,Gr a $ 76,780 gr,Galletas,NOEL,2025-01-15,,,
Sal REFISAL baja en sodio con potasio (800 gr),$ 8.850,Gr a $ 11,800 gr,Sal,REFISAL,2025-01-15,,,
Avena Hojuela TONING 1000 gr,$ 10.250,Gr a $ 10,,Avena,TONING,2025-01-15,,,
Café MATIZ saborizado baileys (240 gr),$ 20.400,Gr a $ 85,240 gr,Café,MATIZ,2025-01-15,,,
Galletas CLUB SOCIAL multicereal x9und (234 gr),$ 7.320,Gr a $ 31,234 gr,Galletas,CLUB SOCIAL,2025-01-15,,,
Café JUAN VALDEZ Liofilizado clásico (95 gr),$ 28.600,Gr a $ 301,95 gr,Café,JUAN VALDEZ,2025-01-15,,,
Tortillas TIA ROSA De Maíz x10und (210 gr),$ 7.420,Gr a $ 35,210 gr,Tortillas,TIA ROSA,2025-01-15,,,
Crema de pollo con verduras LA SOPERA en sobre (43 gr),$ 1.600,Gr a $ 37,43 gr,Crema,LA SOPERA,2025-01-15,,,
Panela Ekono 2 Und EKONO 1000 gr,$ 4.990,Gr a $ 4,,Panela,EKONO,2025-01-15,,,
Condimento TRIGUISAR GRAN COCINA COMPLETO (40 gr),$ 2.250,Gr a $ 56,40 gr,Condimento,TRIGUISAR GRAN COCINA COMPLETO,2025-01-15,,,
Panela Redonda X 8 unidades EKONO 1000 gr,$ 5.560,Gr a $ 5,,Panela,X EKONO,2025-01-15,,,
Pasta EKONO conchas (400 gr),$ 1.910,Gr a $ 4,400 gr,Pasta,EKONO,2025-01-15,,,
Sardina LA SOBERANA Conserva Tinapa Bocado Tomate (80 gr),$ 4.150,Gr a $ 51,80 gr,Sardina,LA SOBERANA,2025-01-15,,,
Salsa Pesto BARILLA MARCA EXCLUSIVA Con Basilico Italiano (190 gr),$ 19.900,Gr a $ 104,190 gr,Salsa,BARILLA MARCA EXCLUSIVA,2025-01-15,,,
Syrup AUNT JEMIMA (355 ml),$ 21.500,Ml a $ 60,355 ml,Syrup,AUNT JEMIMA,2025-01-15,,,
Salsa LA CONSTANCIA Mostaza (190 gr),$ 7.620,Gr a $ 40,190 gr,Salsa,LA CONSTANCIA,2025-01-15,,,
Café SELLO ROJO Tradicional (1000 gr),$ 39.650,Gr a $ 39,1000 gr,Café,SELLO ROJO,2025-01-15,,,
Cereal CHOCO KRISPIS Choco Krispis Chocolate (360 gr),$ 19.750,Gr a $ 54,360 gr,Cereal,CHOCO KRISPIS,2025-01-15,,,
Azúcar MAYAGUEZ (2500 gr),$ 11.700,Gr a $ 4,2500 gr,Azúcar,MAYAGUEZ,2025-01-15,,,
Pasta TAEQ spaghetti de arroz libre de gluten (250 gr),$ 7.040,Gr a $ 28,250 gr,Pasta,TAEQ,2025-01-15,,,
Galletas FESTIVAL Chocolate x12und (403 gr),$ 11.850,Gr a $ 29,403 gr,Galletas,FESTIVAL,2025-01-15,,,
Ajonjolí DORIA en grano (250 gr),$ 13.700,Gr a $ 54,250 gr,Ajonjolí,DORIA,2025-01-15,,,
Caldo de Gallina MAGGI Desmenuzado paga 12 lleva 14 (108 gr),$ 4.232,Gr a $ 39,108 gr,Caldo,MAGGI,2025-01-16,,,
Frijol FRESCAMPO granos seleccionados (500 gr),$ 4.980,Gr a $ 9,500 gr,Frijol,FRESCAMPO,2025-01-16,,,
Display galletas CLUB SOCIAL Original x9Paquetes (216 gr),$ 5.601,Gr a $ 25,216 gr,Display,CLUB SOCIAL,2025-01-16,,,
Galletas SALTINAS 5 TACOS (450 gr),$ 5.280,Gr a $ 11,450 gr,Galletas,SALTINAS TACOS,2025-01-16,,,
Pasta DORIA Macarrón (250 gr),$ 2.250,Gr a $ 9,250 gr,Pasta,DORIA,2025-01-16,,,
Galletas CLUB SOCIAL Integral x9Paquetes (216 gr),$ 6.587,Gr a $ 30,216 gr,Galletas,CLUB SOCIAL,2025-01-16,,,
Pescado en conserva VAN CAMPS En salsa de tomate (146 gr),$ 6.490,Gr a $ 44,146 gr,Pescado,VAN CAMPS,2025-01-16,,,
Arroz ROA (3000 gr),$ 14.750,Gr a $ 4,3000 gr,Arroz,ROA,2025-01-16,,,
Café LUKAFE tostado y molido intenso (600 gr),$ 16.980,Gr a $ 28,600 gr,Café,LUKAFE,2025-01-16,,,
Galletas OREO Original x12Paquetes (432 gr),$ 13.000,Gr a $ 30,432 gr,Galletas,OREO,2025-01-16,,,
Salsa MAGGI bechamel (50 gr),$ 3.664,Gr a $ 73,50 gr,Salsa,MAGGI,2025-01-16,,,
Galletas OREO original x18und (576 gr),$ 14.000,Gr a $ 24,576 gr,Galletas,OREO,2025-01-16,,,
Salsa MAGGI bolognesa (50 gr),$ 3.664,Gr a $ 73,50 gr,Salsa,MAGGI,2025-01-16,,,
Caldo de gallina MAGGI x12 cubos (132 gr),$ 4.080,Gr a $ 30,132 gr,Caldo,MAGGI,2025-01-16,,,
Galletas TOSH tipo sándwich yogurt y fresas (148.8 gr),$ 8.930,Gr a $ 60,148.8 gr,Galletas,TOSH,2025-01-16,,,
Bebida en polvo MILO NUTRI FIT menos azúcares doypack (200 gr),$ 7.920,Gr a $ 39,200 gr,Bebida,MILO NUTRI FIT,2025-01-16,,,
Mostaza FRUCO Doy Pack (200 gr),$ 9.410,Gr a $ 47,200 gr,Mostaza,FRUCO,2025-01-16,,,
MAGGI MAGGI POLLO CHAMPI?ONES (60 gr),$ 2.744,Gr a $ 45,60 gr,MAGGI,MAGGI MAGGI POLLO CHAMPI?ONES,2025-01-16,,,
Salsa MAGGI carbonara (50 gr),$ 3.664,Gr a $ 73,50 gr,Salsa,MAGGI,2025-01-16,,,
Sal REFISAL marina grano medio (800 gr),$ 6.850,Gr a $ 8,800 gr,Sal,REFISAL,2025-01-16,,,
Café COLCAFE clásico (250 gr),$ 32.200,Gr a $ 128,250 gr,Café,COLCAFE,2025-01-16,,,
Caldo de gallina COMPLETÍSIMO x12und desmenuzado (90 gr),$ 4.710,Gr a $ 52,90 gr,Caldo,COMPLETÍSIMO,2025-01-16,,,
Café JUAN VALDEZ Liofilizado avellana (95 gr),$ 31.700,Gr a $ 333,95 gr,Café,JUAN VALDEZ,2025-01-16,,,
Bebida en polvo MILO NUTRI FIT menos azúcares doypack (500 gr),$ 21.520,Gr a $ 43,500 gr,Bebida,MILO NUTRI FIT,2025-01-16,,,
Galletas TOSH Wafer yogurt fresa y acaí x6 und (162 gr),$ 9.680,Gr a $ 59,162 gr,Galletas,TOSH,2025-01-16,,,
Cereal CHOCAPIC sabor chocolate bolsa (380 gr),$ 13.120,Gr a $ 34,380 gr,Cereal,CHOCAPIC,2025-01-16,,,
Caldo con costilla MAGGI Desmenuzado paga 10 lleva 12 (90 gr),$ 3.424,Gr a $ 38,90 gr,Caldo,MAGGI,2025-01-16,,,
Cocoa CORONA Baja en grasa (230 gr),$ 16.550,Gr a $ 71,230 gr,Cocoa,CORONA,2025-01-16,,,
Macarrón DORIA Con Salsa De Queso (210 gr),$ 4.570,Gr a $ 21,210 gr,Macarrón,DORIA,2025-01-16,,,
Bebida en polvo NESQUIK sabor a chocolate doypack (400 gr),$ 11.560,Gr a $ 28,400 gr,Bebida,NESQUIK,2025-01-16,,,
Galletas SALTINAS 3 TACOS INTEGRAL (324 gr),$ 7.688,Gr a $ 23,324 gr,Galletas,SALTINAS TACOS INTEGRAL,2025-01-16,,,
Café Descafeinado NESCAFE DECAF instantáneo (100 gr),$ 13.760,Gr a $ 137,100 gr,Café,NESCAFE DECAF,2025-01-16,,,
Galletas RITZ Rellenas de Crema Sabor Queso x6paq (180 gr),$ 8.680,Gr a $ 48,180 gr,Galletas,RITZ,2025-01-16,,,
Café JUAN VALDEZ Liofilizado vanicanela (95 gr),$ 32.800,Gr a $ 345,95 gr,Café,JUAN VALDEZ,2025-01-16,,,
Tortillas TIA ROSA De Trigo x12und (300 gr),$ 6.560,Gr a $ 21,300 gr,Tortillas,TIA ROSA,2025-01-16,,,
Arroz FEDERAL Premium extra gourmet (2500 gr),$ 22.482,Gr a $ 8,2500 gr,Arroz,FEDERAL,2025-01-16,,,
Pimienta EL REY (60 gr),$ 3.740,Gr a $ 62,60 gr,Pimienta,EL REY,2025-01-16,,,
MAGGI MAGGI CHAMPI?ONES (58 gr),$ 2.744,Gr a $ 47,58 gr,MAGGI,MAGGI MAGGI CHAMPI?ONES,2025-01-16,,,
MAGGI MAGGI MARINERA (56 gr),$ 2.744,Gr a $ 49,56 gr,MAGGI,MAGGI MAGGI MARINERA,2025-01-16,,,
MAGGI MAGGI TOMATE (61 gr),$ 2.760,Gr a $ 45,61 gr,MAGGI,MAGGI MAGGI TOMATE,2025-01-16,,,
MAGGI MAGGI AJIACO (60 gr),$ 2.072,Gr a $ 34,60 gr,MAGGI,MAGGI MAGGI AJIACO,2025-01-16,,,
Café CAFE QUINDIO gourmet tostado y molido (454 gr),$ 34.250,Gr a $ 75,454 gr,Café,CAFE QUINDIO,2025-01-16,,,
GALLETAS OREO GALLETAS (262.4 gr),$ 14.320,Gr a $ 54,262.4 gr,GALLETAS,GALLETAS OREO GALLETAS,2025-01-16,,,
Galletas CLUB SOCIAL multicereal x9und (234 gr),$ 6.885,Gr a $ 29,234 gr,Galletas,CLUB SOCIAL,2025-01-16,,,
Galletas TOSH Tipo sandwich cremadas vainilla (144 gr),$ 9.580,Gr a $ 66,144 gr,Galletas,TOSH,2025-01-16,,,
Galletas MILO Anillos relleno crema x12 paquetes (390 gr),$ 10.600,Gr a $ 27,390 gr,Galletas,MILO,2025-01-16,,,
Caldo de gallina MAGGI x48 cubos (528 gr),$ 16.360,Gr a $ 30,528 gr,Caldo,MAGGI,2025-01-16,,,
Mezcla HAZ DE OROS para buñuelos (300 gr),$ 5.950,Gr a $ 19,300 gr,Mezcla,HAZ DE OROS,2025-01-16,,,
Bebida en polvo MILO a base de malta y cocoa doypack (1500 gr),$ 47.200,Gr a $ 31,1500 gr,Bebida,MILO,2025-01-16,,,
VINAGRETA ADEREZOS Original Para Ensaladas (270 gr),$ 11.350,Gr a $ 42,270 gr,VINAGRETA,VINAGRETA ADEREZOS,2025-01-16,,,
Cereal NESTLE sin gluten caja (405 gr),$ 12.280,Gr a $ 30,405 gr,Cereal,NESTLE,2025-01-16,,,
Café CAFE QUINDIO gourmet (250 gr),$ 22.000,Gr a $ 88,250 gr,Café,CAFE QUINDIO,2025-01-16,,,
Arroz CASTELLANO (500 gr),$ 5.670,Gr a $ 11,500 gr,Arroz,CASTELLANO,2025-01-16,,,
MAGGI MAGGI CREMA DE POLLO (61 gr),$ 2.744,Gr a $ 44,61 gr,MAGGI,MAGGI MAGGI CREMA DE POLLO,2025-01-16,,,
Aceite vegetal FRESCAMPO mezcla de aceites (3000 ml),$ 22.980,Ml a $ 7,3000 ml,Aceite,FRESCAMPO,2025-01-16,,,
Azúcar EXITO MARCA PROPIA blanca (2500 gr),$ 11.490,Gr a $ 4,2500 gr,Azúcar,EXITO MARCA PROPIA,2025-01-16,,,
Atún EXITO MARCA PROPIA lomitos en agua (110.5 gr),$ 4.430,Gr a $ 40,110.5 gr,Atún,EXITO MARCA PROPIA,2025-01-16,,,
Lenteja FRESCAMPO granos seleccionados (1000 gr),$ 6.970,Gr a $ 6,1000 gr,Lenteja,FRESCAMPO,2025-01-16,,,
Frijol FRESCAMPO granos seleccionados (500 gr),$ 4.480,Gr a $ 8,500 gr,Frijol,FRESCAMPO,2025-01-16,,,
Sal REFISAL alta pureza (1000 gr),$ 2.530,Gr a $ 2,1000 gr,Sal,REFISAL,2025-01-16,,,
Lenteja FRESCAMPO granos seleccionados (500 gr),$ 3.480,Gr a $ 6,500 gr,Lenteja,FRESCAMPO,2025-01-16,,,
Galletas SALTIN NOEL Tradicional x6 tacos (531 gr),$ 9.900,Gr a $ 18,531 gr,Galletas,SALTIN NOEL,2025-01-16,,,
harina PAN (1000 gr),$ 3.400,Gr a $ 3,1000 gr,harina,PAN,2025-01-16,,,
Aceite de oliva EXITO MARCA PROPIA extra virgen (500 ml),$ 21.940,Ml a $ 43,500 ml,Aceite,EXITO MARCA PROPIA,2025-01-16,,,
Pasta EKONO fideos (250 gr),$ 1.190,Gr a $ 4,250 gr,Pasta,EKONO,2025-01-16,,,
Arroz EXITO MARCA PROPIA blanco arroba (12500 gr),$ 47.980,Gr a $ 3,12500 gr,Arroz,EXITO MARCA PROPIA,2025-01-16,,,
Arroz EXITO MARCA PROPIA blanco (500 gr),$ 1.940,Gr a $ 3,500 gr,Arroz,EXITO MARCA PROPIA,2025-01-16,,,
PANELA PEQUEÑA EMPA REGIONAL EP 908 gr,$ 5.380,Gr a $ 5,,PANELA,PANELA PEQUEÑA EMPA REGIONAL EP,2025-01-16,,,
Arroz EXITO MARCA PROPIA blanco (2500 gr),$ 9.640,Gr a $ 3,2500 gr,Arroz,EXITO MARCA PROPIA,2025-01-16,,,
Harina DONAREPA precocida de maíz blanco (1000 gr),$ 3.640,Gr a $ 3,1000 gr,Harina,DONAREPA,2025-01-16,,,
Café SELLO ROJO Molido fuerte (600 gr),$ 23.250,Gr a $ 38,600 gr,Café,SELLO ROJO,2025-01-16,,,
Arroz DIANA (5000 gr),$ 23.100,Gr a $ 4,5000 gr,Arroz,DIANA,2025-01-16,,,
Atún EXITO MARCA PROPIA lomitos en aceite (110.5 gr),$ 5.390,Gr a $ 48,110.5 gr,Atún,EXITO MARCA PROPIA,2025-01-16,,,
Aceite EXITO MARCA PROPIA de girasol (900 ml),$ 8.340,Ml a $ 9,900 ml,Aceite,EXITO MARCA PROPIA,2025-01-16,,,
Azúcar EXITO MARCA PROPIA blanca (1000 gr),$ 4.890,Gr a $ 4,1000 gr,Azúcar,EXITO MARCA PROPIA,2025-01-16,,,
Pasta LA MUNECA spaguetti (1000 gr),$ 5.050,Gr a $ 5,1000 gr,Pasta,LA MUNECA,2025-01-16,,,
Arroz DIANA (3000 gr),$ 13.950,Gr a $ 4,3000 gr,Arroz,DIANA,2025-01-16,,,
Atún VAN CAMPS En aceite de oliva (156 gr),$ 15.000,Gr a $ 96,156 gr,Atún,VAN CAMPS,2025-01-16,,,
Café AGUILA ROJA (500 gr),$ 17.600,Gr a $ 35,500 gr,Café,AGUILA ROJA,2025-01-16,,,
Harina de trigo HAZ DE OROS tradicional (500 gr),$ 1.980,Gr a $ 3,500 gr,Harina,HAZ DE OROS,2025-01-16,,,
Vinagre FRESCAMPO blanco (1000 ml),$ 3.990,Ml a $ 3,1000 ml,Vinagre,FRESCAMPO,2025-01-16,,,
Azucar MANUELITA (1000 gr),$ 5.160,Gr a $ 5,1000 gr,Azucar,MANUELITA,2025-01-16,,,
Caldo de Gallina MAGGI Desmenuzado paga 12 lleva 14 (108 gr),$ 5.290,Gr a $ 48,108 gr,Caldo,MAGGI,2025-01-16,,,
Pasta DORIA spaguetti clásica (250 gr),$ 2.050,Gr a $ 8,250 gr,Pasta,DORIA,2025-01-16,,,
Frijol FRESCAMPO granos seleccionados (500 gr),$ 5.180,Gr a $ 10,500 gr,Frijol,FRESCAMPO,2025-01-16,,,
Pasta EKONO spaghetti (250 gr),$ 1.240,Gr a $ 4,250 gr,Pasta,EKONO,2025-01-16,,,
Arroz DIANA (1000 gr),$ 5.980,Gr a $ 5,1000 gr,Arroz,DIANA,2025-01-16,,,
Spaguetti DORIA Clásico (1000 gr),$ 5.760,Gr a $ 5,1000 gr,Spaguetti,DORIA,2025-01-16,,,
Aceite vegetal FRESCAMPO mezcla de aceites (900 ml),$ 7.480,Ml a $ 8,900 ml,Aceite,FRESCAMPO,2025-01-16,,,
Galletas DUCALES x5 tacos (500 gr),$ 13.600,Gr a $ 27,500 gr,Galletas,DUCALES,2025-01-16,,,
Azucar MANUELITA (2000 gr),$ 9.700,Gr a $ 4,2000 gr,Azucar,MANUELITA,2025-01-16,,,
Galletas TOSH Crackers miel x9 und (243 gr),$ 8.560,Gr a $ 35,243 gr,Galletas,TOSH,2025-01-16,,,
Atún VAN CAMPS En aceite de girasol (416 gr),$ 38.200,Gr a $ 91,416 gr,Atún,VAN CAMPS,2025-01-16,,,
Maíz pira FRESCAMPO granos seleccionados (500 gr),$ 2.230,Gr a $ 4,500 gr,Maíz,FRESCAMPO,2025-01-16,,,
Azúcar MANUELITA (1000 gr),$ 5.560,Gr a $ 5,1000 gr,Azúcar,MANUELITA,2025-01-16,,,
Café EXITO MARCA PROPIA tostado y molido (500 gr),$ 14.500,Gr a $ 29,500 gr,Café,EXITO MARCA PROPIA,2025-01-16,,,
Salsa De Tomate FRUCO Doy Pack (400 gr),$ 9.140,Gr a $ 22,400 gr,Salsa,FRUCO,2025-01-16,,,
Arroz EXITO MARCA PROPIA blanco (5000 gr),$ 22.250,Gr a $ 4,5000 gr,Arroz,EXITO MARCA PROPIA,2025-01-16,,,
Salsa De Tomate FRUCO Frasco (1000 gr),$ 18.800,Gr a $ 18,1000 gr,Salsa,FRUCO,2025-01-16,,,
Garbanzo FRESCAMPO granos seleccionados (500 gr),$ 3.950,Gr a $ 7,500 gr,Garbanzo,FRESCAMPO,2025-01-16,,,
Aceite GOURMET multiusos (900 ml),$ 20.500,Ml a $ 22,900 ml,Aceite,GOURMET,2025-01-16,,,
Display galletas CLUB SOCIAL Original x9Paquetes (216 gr),$ 6.590,Gr a $ 30,216 gr,Display,CLUB SOCIAL,2025-01-16,,,
Pasta EKONO macarrones (250 gr),$ 1.190,Gr a $ 4,250 gr,Pasta,EKONO,2025-01-16,,,
Salsa de tomate EKONO doy pack (500 gr),$ 6.390,Gr a $ 12,500 gr,Salsa,EKONO,2025-01-16,,,
Maicitos FRESCAMPO dulces (285 gr),$ 5.560,Gr a $ 19,285 gr,Maicitos,FRESCAMPO,2025-01-16,,,
Cafe TOSTAO Tostado y Molido (454 gr),$ 16.600,Gr a $ 36,454 gr,Cafe,TOSTAO,2025-01-16,,,
Aceite PREMIER comestible girasol (1800 ml),$ 28.200,Ml a $ 15,1800 ml,Aceite,PREMIER,2025-01-16,,,
Gelatina Fruto rojosUvaFresa FRESCAMPO 120 gr,$ 3.480,Gr a $ 29,,Gelatina,FRESCAMPO,2025-01-16,,,
Galletas SALTINAS 5 TACOS (450 gr),$ 6.600,Gr a $ 14,450 gr,Galletas,SALTINAS TACOS,2025-01-16,,,
Ajo EL REY (55 gr),$ 1.550,Gr a $ 28,55 gr,Ajo,EL REY,2025-01-16,,,
Pasta DORIA Corriente Fideo (250 gr),$ 2.250,Gr a $ 9,250 gr,Pasta,DORIA,2025-01-16,,,
Pastas MONTICELLO spaghetti premium (500 gr),$ 7.990,Gr a $ 15,500 gr,Pastas,MONTICELLO,2025-01-16,,,
Arroz DIANA (2500 gr),$ 15.600,Gr a $ 6,2500 gr,Arroz,DIANA,2025-01-16,,,
Arroz DIANA (12500 gr),$ 52.450,Gr a $ 4,12500 gr,Arroz,DIANA,2025-01-16,,,
Harina PAN (500 gr),$ 5.850,Gr a $ 11,500 gr,Harina,PAN,2025-01-16,,,
Galletas DUCALES x8 tacos (800 gr),$ 21.350,Gr a $ 26,800 gr,Galletas,DUCALES,2025-01-16,,,
Bicarbonato FRESCAMPO de sodio (500 gr),$ 3.440,Gr a $ 6,500 gr,Bicarbonato,FRESCAMPO,2025-01-16,,,
Aceite EXITO MARCA PROPIA de girasol (2000 ml),$ 17.890,Ml a $ 8,2000 ml,Aceite,EXITO MARCA PROPIA,2025-01-16,,,
Lomos Atun ZENU Aceite de girasol (104 gr),$ 7.400,Gr a $ 71,104 gr,Lomos,ZENU,2025-01-16,,,
Chocolate en polvo LYNE Endulzado (200 gr),$ 13.920,Gr a $ 69,200 gr,Chocolate,LYNE,2025-01-16,,,
PANELA PASTILLA FONCE 450 gr,$ 5.660,Gr a $ 12,,PANELA,PANELA PASTILLA FONCE,2025-01-16,,,
Chocolate de mesa CORONA TRADICIONAL PASTILLADO (450 gr),$ 15.950,Gr a $ 35,450 gr,Chocolate,CORONA TRADICIONAL PASTILLADO,2025-01-16,,,
Café JUAN VALDEZ Colina molido (454 gr),$ 44.300,Gr a $ 97,454 gr,Café,JUAN VALDEZ,2025-01-16,,,
Chocolate SOL de mesa tradicional en pasta (500 gr),$ 14.850,Gr a $ 29,500 gr,Chocolate,SOL,2025-01-16,,,
Arroz CASTELLANO (2500 gr),$ 26.350,Gr a $ 10,2500 gr,Arroz,CASTELLANO,2025-01-16,,,
Vinagre FRESCAMPO blanco (500 ml),$ 2.490,Ml a $ 4,500 ml,Vinagre,FRESCAMPO,2025-01-16,,,
Frijol FRESCAMPO del campo granos seleccionados (500 gr),$ 3.950,Gr a $ 7,500 gr,Frijol,FRESCAMPO,2025-01-16,,,
Aceite vegetal FRESCAMPO mezcla de aceites (2000 ml),$ 17.230,Ml a $ 8,2000 ml,Aceite,FRESCAMPO,2025-01-16,,,
Arveja FRESCAMPO del campo granos seleccionados (500 gr),$ 1.980,Gr a $ 3,500 gr,Arveja,FRESCAMPO,2025-01-16,,,
Pancake AUNT JEMIMA (600 gr),$ 12.200,Gr a $ 20,600 gr,Pancake,AUNT JEMIMA,2025-01-16,,,
Pasta DORIA Macarrón (250 gr),$ 2.050,Gr a $ 8,250 gr,Pasta,DORIA,2025-01-16,,,
Galletas CLUB SOCIAL Integral x9Paquetes (216 gr),$ 7.750,Gr a $ 35,216 gr,Galletas,CLUB SOCIAL,2025-01-16,,,
Galletas SALTIN NOEL Tradicional x5 tacos (500 gr),$ 8.830,Gr a $ 17,500 gr,Galletas,SALTIN NOEL,2025-01-16,,,
Salsa De Tomate FRUCO Doy Pack (600 gr),$ 10.440,Gr a $ 17,600 gr,Salsa,FRUCO,2025-01-16,,,
Tortillas BIMBO Tradicional Tamaño M x15und (450 gr),$ 12.650,Gr a $ 28,450 gr,Tortillas,BIMBO M,2025-01-16,,,
Bebida achocolatada CHOCOLISTO En polvo (400 gr),$ 16.200,Gr a $ 40,400 gr,Bebida,CHOCOLISTO,2025-01-16,,,
Galletas FESTIVAL Minichips x12und (420 gr),$ 18.100,Gr a $ 43,420 gr,Galletas,FESTIVAL,2025-01-16,,,
Pescado en conserva VAN CAMPS En salsa de tomate (146 gr),$ 6.190,Gr a $ 42,146 gr,Pescado,VAN CAMPS,2025-01-16,,,
Café MATIZ tostión oscura y molienda gruesa (340 gr),$ 24.300,Gr a $ 71,340 gr,Café,MATIZ,2025-01-16,,,
Atún VAN CAMPS En agua natural (156 gr),$ 11.080,Gr a $ 71,156 gr,Atún,VAN CAMPS,2025-01-16,,,
Panela Pastilla LA TOBIANA 1000 gr,$ 8.450,Gr a $ 8,,Panela,LA TOBIANA,2025-01-16,,,
Garbanzo FRESCAMPO granos seleccionados (1000 gr),$ 6.850,Gr a $ 6,1000 gr,Garbanzo,FRESCAMPO,2025-01-16,,,
Galletas NOEL rellena con crema (432 gr),$ 7.992,Gr a $ 18,432 gr,Galletas,NOEL,2025-01-16,,,
Chocolate de mesa LA ESPECIAL pastillado con azúcar (400 gr),$ 11.750,Gr a $ 29,400 gr,Chocolate,LA ESPECIAL,2025-01-16,,,
Pasta CONZAZONI larga fetuccine (500 gr),$ 6.690,Gr a $ 13,500 gr,Pasta,CONZAZONI,2025-01-16,,,
Arroz ROA (3000 gr),$ 12.700,Gr a $ 4,3000 gr,Arroz,ROA,2025-01-16,,,
Atún VAN CAMPS En agua natural (416 gr),$ 37.400,Gr a $ 89,416 gr,Atún,VAN CAMPS,2025-01-16,,,
Mayonesa FRUCO Doy Pack (380 gr),$ 10.750,Gr a $ 28,380 gr,Mayonesa,FRUCO,2025-01-16,,,
Frijol FRESCAMPO del campo granos seleccionados (1000 gr),$ 12.950,Gr a $ 12,1000 gr,Frijol,FRESCAMPO,2025-01-16,,,
Arroz DIANA (1000 gr),$ 4.600,Gr a $ 4,1000 gr,Arroz,DIANA,2025-01-16,,,
Frijol DIANA (500 gr),$ 7.050,Gr a $ 14,500 gr,Frijol,DIANA,2025-01-16,,,
Arvejas con zanahoria ZENU lata x2und (600 gr),$ 11.100,Gr a $ 18,600 gr,Arvejas,ZENU,2025-01-16,,,
Atún EKONO rallado (170 gr),$ 3.440,Gr a $ 20,170 gr,Atún,EKONO,2025-01-16,,,
Avena en Hojuelas EKONO 1000 gr,$ 5.590,Gr a $ 5,,Avena,EKONO,2025-01-16,,,
Café instantáneo NESCAFE TRADICIÓN (170 gr),$ 27.000,Gr a $ 158,170 gr,Café,NESCAFE TRADICIÓN,2025-01-16,,,
Café LUKAFE tostado y molido intenso (600 gr),$ 18.900,Gr a $ 31,600 gr,Café,LUKAFE,2025-01-16,,,
Chocolate de mesa TESALIA clavos y canela sin azúcar (250 gr),$ 16.500,Gr a $ 66,250 gr,Chocolate,TESALIA,2025-01-16,,,
Arroz Blanco ROA 500 gr,$ 2.180,Gr a $ 4,,Arroz,ROA,2025-01-16,,,
Galletas SALTIN NOEL Queso mantequilla x3 tacos (338 gr),$ 8.250,Gr a $ 24,338 gr,Galletas,SALTIN NOEL,2025-01-16,,,
Galletas OREO Original x12Paquetes (432 gr),$ 16.250,Gr a $ 37,432 gr,Galletas,OREO,2025-01-16,,,
SAL NATUSAL Sal Marina Fina (1000 gr),$ 2.090,Gr a $ 2,1000 gr,SAL,SAL NATUSAL,2025-01-16,,,
